Верно ли, что на свете нет злых людей, а есть только несчастливые?="Духовно-нравственные ориентиры в жизни человека".
Можно ли делить зло на «малое» и «большое»?="Духовно-нравственные ориентиры в жизни человека".
Может ли дружба принести человеку разочарование?="Духовно-нравственные ориентиры в жизни человека".
С каким спутником легко в дороге?="Духовно-нравственные ориентиры в жизни человека".
Почему человек может бояться высказать свою позицию?="Духовно-нравственные ориентиры в жизни человека".
Важно ли, идя по жизни вперёд, оглядываться на пройденный путь?="Духовно-нравственные ориентиры в жизни человека".
На пути к благородной цели все ли средства хороши?="Духовно-нравственные ориентиры в жизни человека".
Какие средства не могут быть оправданы никакой целью?="Духовно-нравственные ориентиры в жизни человека".
Кого можно назвать верным другом?="Духовно-нравственные ориентиры в жизни человека".
Как Вы понимаете слово «долг»?="Духовно-нравственные ориентиры в жизни человека".
Помогает ли любовь справляться с жизненными трудностями?="Духовно-нравственные ориентиры в жизни человека".
Как связаны понятия "любовь" и "ответственность"?="Духовно-нравственные ориентиры в жизни человека".
Как выбрать жизненную дорогу?="Духовно-нравственные ориентиры в жизни человека".
Нужно ли осуждать отчаявшегося человека?="Духовно-нравственные ориентиры в жизни человека".
Требует ли любовь от человека работы над собой?="Духовно-нравственные ориентиры в жизни человека".
Над какими чувствами разум может быть не властен?="Духовно-нравственные ориентиры в жизни человека".
Мечтательность – это достоинство или недостаток?="Духовно-нравственные ориентиры в жизни человека".
Каким путём человек идёт к самому себе?="Духовно-нравственные ориентиры в жизни человека".
Что делает человека подлинно счастливым?="Духовно-нравственные ориентиры в жизни человека".
Может ли отзывчивый человек быть одиноким?="Духовно-нравственные ориентиры в жизни человека".
Как Вы понимаете призыв Д.С. Лихачёва: «Твори добро, не видя в том заслуги»?="Духовно-нравственные ориентиры в жизни человека".
Может ли доброта победить жестокость?="Духовно-нравственные ориентиры в жизни человека".
Когда человек оказывается перед выбором между верностью и изменой?="Духовно-нравственные ориентиры в жизни человека".
Хорош ли жизненный принцип – действовать методом проб и ошибок?="Духовно-нравственные ориентиры в жизни человека".
Когда важнее руководствоваться чувствами, а не разумом?="Духовно-нравственные ориентиры в жизни человека".
Согласны ли Вы с утверждением Андрея Болконского: «Я знаю в жизни только два настоящих несчастья: это угрызение совести и болезнь»?="Духовно-нравственные ориентиры в жизни человека".
Когда любовь становится испытанием?="Духовно-нравственные ориентиры в жизни человека".
О чём люди чаще всего мечтают?="Духовно-нравственные ориентиры в жизни человека".
Какие отношения между друзьями Вы считаете гармоничными?="Духовно-нравственные ориентиры в жизни человека".
Согласны ли Вы с утверждением французского писателя А. Дюма: «Тот, кто мстит, иногда жалеет о совершённом; тот, кто прощает, никогда не жалеет об этом»?="Духовно-нравственные ориентиры в жизни человека".
Что мешает взаимопониманию между любящими?="Духовно-нравственные ориентиры в жизни человека".
Какие качества раскрывает в человеке дружба?="Духовно-нравственные ориентиры в жизни человека".
Как Вы понимаете, что такое «честь» и «бесчестие»?="Духовно-нравственные ориентиры в жизни человека".
Почему важно научиться прощать?="Духовно-нравственные ориентиры в жизни человека".
Важно ли человеку самому выбрать свой жизненный путь?="Духовно-нравственные ориентиры в жизни человека".
Может ли дружба обернуться враждой?="Духовно-нравственные ориентиры в жизни человека".
Что мешает человеку реализовать свою мечту?="Духовно-нравственные ориентиры в жизни человека".
Какие жизненные события могут научить доброте?="Духовно-нравственные ориентиры в жизни человека".
Стоит ли мечтать о несбыточном?="Духовно-нравственные ориентиры в жизни человека".
Разделяете ли Вы убеждение героя романа «Война и мир» в том, что «гораздо благороднее осознать свою ошибку, чем довести дело до непоправимого»?="Духовно-нравственные ориентиры в жизни человека".
Согласны ли Вы с утверждением, что «время лечит»?="Духовно-нравственные ориентиры в жизни человека".
Почему месть не помогает искоренить зло?="Духовно-нравственные ориентиры в жизни человека".
Чем месть отличается от справедливого наказания?="Духовно-нравственные ориентиры в жизни человека".
Помогает ли любовь лучше понять самого себя?="Духовно-нравственные ориентиры в жизни человека".
Что важнее: любить или быть любимым?="Духовно-нравственные ориентиры в жизни человека".
Всегда ли лучше учиться на чужих ошибках, чем на своих?="Духовно-нравственные ориентиры в жизни человека".
Что значит – найти в жизни свою дорогу?="Духовно-нравственные ориентиры в жизни человека".
К каким последствиям может привести конфликт между чувствами и разумом?="Духовно-нравственные ориентиры в жизни человека".
Что значит быть честным с самим собой?="Духовно-нравственные ориентиры в жизни человека".
Почему так опасно «переступить черту»?="Духовно-нравственные ориентиры в жизни человека".
Когда победа не приносит радости и удовлетворения?="Духовно-нравственные ориентиры в жизни человека".
Как связаны между собой равнодушие и жестокость?="Духовно-нравственные ориентиры в жизни человека".
Есть ли разница между гордостью и заносчивостью?="Духовно-нравственные ориентиры в жизни человека".
В чём разница межу наказанием и местью?="Духовно-нравственные ориентиры в жизни человека".
Что нужно, чтобы любовь между мужчиной и женщиной не иссякла?="Духовно-нравственные ориентиры в жизни человека".
Как Вы понимаете утверждение, что главное условие исправления преступника – осознание своей вины?="Духовно-нравственные ориентиры в жизни человека".
Почему важно уметь контролировать свои эмоции?="Духовно-нравственные ориентиры в жизни человека".
Когда слово становится преступлением?="Духовно-нравственные ориентиры в жизни человека".
Легко ли быть победителем?="Духовно-нравственные ориентиры в жизни человека".
Как связаны добро и радость?="Духовно-нравственные ориентиры в жизни человека".
Чем руководствоваться в выборе жизненных целей?="Духовно-нравственные ориентиры в жизни человека".
Какие вопросы нужно задавать самому себе?="Духовно-нравственные ориентиры в жизни человека".
Как соотносятся понятия «великодушие» и «широта души»?="Духовно-нравственные ориентиры в жизни человека".
Что должно оставаться неизменным в любое время (любую эпоху)?="Духовно-нравственные ориентиры в жизни человека".
Чем «история души человеческой» может быть интересна другому человеку?="Духовно-нравственные ориентиры в жизни человека".
Какие жизненные победы могут быть важны для человека?="Духовно-нравственные ориентиры в жизни человека".
«Время не ждёт и не прощает ни одного потерянного мгновения» (Н.Г. Гарин-Михайловский»)="Духовно-нравственные ориентиры в жизни человека".
Что важнее в дружбе: получать или отдавать?="Духовно-нравственные ориентиры в жизни человека".
В чём драматизм поединка между гордостью и смирением?="Духовно-нравственные ориентиры в жизни человека".
Кто никогда не отчаивался, не знает цену надежды.="Духовно-нравственные ориентиры в жизни человека".
Как противостоять ударам судьбы?="Духовно-нравственные ориентиры в жизни человека".
Можно ли прожить без мечты?="Духовно-нравственные ориентиры в жизни человека".
Как бы Вы ответили на вопрос Гамлета: «Достойно ль смиряться под ударами судьбы, иль надо оказать сопротивленье?»="Духовно-нравственные ориентиры в жизни человека".
Всегда ли неизбежен конфликт мечты и действительности?="Духовно-нравственные ориентиры в жизни человека".
Измена близкого человека как горький жизненный опыт.="Духовно-нравственные ориентиры в жизни человека".
В чём, по-вашему, истинное предназначение мужчины?="Духовно-нравственные ориентиры в жизни человека".
Как нужно относиться к собственным слабостям?="Духовно-нравственные ориентиры в жизни человека".
Когда безответственность приводит к преступлению?="Духовно-нравственные ориентиры в жизни человека".
Какие ориентиры помогают не заблудиться на жизненном пути?="Духовно-нравственные ориентиры в жизни человека".
К каким последствиям может привести ревность?="Духовно-нравственные ориентиры в жизни человека".
Нужно ли бороться за свою мечту?="Духовно-нравственные ориентиры в жизни человека".
Равнодушие – вина человека или его беда?="Духовно-нравственные ориентиры в жизни человека".
Можно ли сохранить дружбу на годы?="Духовно-нравственные ориентиры в жизни человека".
Всегда ли измена своим убеждениям – это измена самому себе?="Духовно-нравственные ориентиры в жизни человека".
Считаете ли Вы синонимами понятия «отзывчивость» и «милосердие»?="Духовно-нравственные ориентиры в жизни человека".
В чём проявляется великодушие победителя?="Духовно-нравственные ориентиры в жизни человека".
Месть – это уничтожение или умножение зла?="Духовно-нравственные ориентиры в жизни человека".
Какие времена можно назвать жестокими?="Духовно-нравственные ориентиры в жизни человека".
Можно ли считать муки совести достаточным наказанием за преступление?="Духовно-нравственные ориентиры в жизни человека".
Почему люди обманывают себя?="Духовно-нравственные ориентиры в жизни человека".
Может ли достижение заветной цели привести человека к разочарованию?="Духовно-нравственные ориентиры в жизни человека".
Почему предательство обычно ищет для себя оправданий?="Духовно-нравственные ориентиры в жизни человека".
Возможно ли равенство мужчины и женщины?="Духовно-нравственные ориентиры в жизни человека".
Когда разум и чувство борются в человеке?="Духовно-нравственные ориентиры в жизни человека".
Когда непонимание между людьми приводит к вражде?="Духовно-нравственные ориентиры в жизни человека".
Верно ли, что сохранить любовь бывает труднее, чем её обрести?="Духовно-нравственные ориентиры в жизни человека".
Согласны ли Вы с мыслью, что отзывчивость – признак душевной силы человека?="Духовно-нравственные ориентиры в жизни человека".
Оправдано ли стремление к недостижимому идеалу?="Духовно-нравственные ориентиры в жизни человека".
Можно ли прожить жизнь, не совершив ошибок?="Духовно-нравственные ориентиры в жизни человека".
Без каких ошибок невозможно движение по жизненному пути?="Духовно-нравственные ориентиры в жизни человека".
Почему для человека важны не только победы, но и поражения?="Духовно-нравственные ориентиры в жизни человека".
Согласны ли Вы с тем, что «на ошибках учатся»?="Духовно-нравственные ориентиры в жизни человека".
Война – проверка на мужество и человечность.="Духовно-нравственные ориентиры в жизни человека".
Согласны ли Вы с утверждением, что человек не волен в своих чувствах?="Духовно-нравственные ориентиры в жизни человека".
Как влияет на сущность человека война?="Духовно-нравственные ориентиры в жизни человека".
Что может меняться и что должно быть неизменным в человеке?="Духовно-нравственные ориентиры в жизни человека".
Согласны ли Вы с утверждением Л. Н. Андреева: «Настоящую любовь можно узнать по тому, насколько от неё человек становится лучше…»="Духовно-нравственные ориентиры в жизни человека".
Сохранить человечность на войне… (По страницам литературы XIX-XXI вв.="Духовно-нравственные ориентиры в жизни человека".
Всегда ли она достойна его?="Духовно-нравственные ориентиры в жизни человека".
Какую победу Вы бы назвали самой трудной для человека?="Духовно-нравственные ориентиры в жизни человека".
Что может привести к разрушению любви?="Духовно-нравственные ориентиры в жизни человека".
Что помогает человеку преодолеть страх?="Духовно-нравственные ориентиры в жизни человека".
Если надежды не сбылись, они были напрасны?="Духовно-нравственные ориентиры в жизни человека".
Какие ценности должны оставаться неизменными при любых переменах?="Духовно-нравственные ориентиры в жизни человека".
Что значит жить для людей?="Духовно-нравственные ориентиры в жизни человека".
Какие качества характера ценятся больше всего в мужчине, а какие – в женщине?="Духовно-нравственные ориентиры в жизни человека".
Есть ли разница между жестокостью и суровостью?="Духовно-нравственные ориентиры в жизни человека".
В чём заключается сила доброты?="Духовно-нравственные ориентиры в жизни человека".
Как Вы понимаете слово «совесть»?="Духовно-нравственные ориентиры в жизни человека".
Почему эгоизм мешает быть великодушным?="Духовно-нравственные ориентиры в жизни человека".
Можно ли заслужить прощение?="Духовно-нравственные ориентиры в жизни человека".
Можно ли проявить смелость в повседневной жизни?="Духовно-нравственные ориентиры в жизни человека".
Могут ли мечты быть помощью на жизненном пути?="Духовно-нравственные ориентиры в жизни человека".
Как меняются мечты по мере взросления человека?="Духовно-нравственные ориентиры в жизни человека".
Что помогает человеку сохранить надежду даже в самых тяжёлых ситуациях?="Духовно-нравственные ориентиры в жизни человека".
Важно ли анализировать свои удачи и промахи?="Духовно-нравственные ориентиры в жизни человека".
Могут ли соседствовать высокие мечты и суровая реальность?="Духовно-нравственные ориентиры в жизни человека".
Что можно и нужно побеждать в самом себе?="Духовно-нравственные ориентиры в жизни человека".
Чем путешествия обогащают личность?="Духовно-нравственные ориентиры в жизни человека".
Может ли совесть наказать сильнее, чем суд?="Духовно-нравственные ориентиры в жизни человека".
Страдают ли жестокие люди?="Духовно-нравственные ориентиры в жизни человека".
Согласны ли Вы с утверждением, что равнодушие обедняет жизнь человека?="Духовно-нравственные ориентиры в жизни человека".
Что разрушает дружбу?="Духовно-нравственные ориентиры в жизни человека".
Как Вы понимаете мысль одного из героев романа «Война и мир»: «Источник блаженства не вне, а внутри нас...»?="Духовно-нравственные ориентиры в жизни человека".
Согласны ли Вы с утверждением, что истинная доброта всегда бескорыстна?="Духовно-нравственные ориентиры в жизни человека".
Зачем человеку друзья?="Духовно-нравственные ориентиры в жизни человека".
Какие уроки можно извлечь из поражения?="Духовно-нравственные ориентиры в жизни человека".
Можно ли простить злой поступок?="Духовно-нравственные ориентиры в жизни человека".
