Дом – это место или люди?="Семья, общество, Отечество в жизни человека".
Бывает ли общественное мнение ошибочным?="Семья, общество, Отечество в жизни человека".
Каким человеком могут гордиться окружающие?="Семья, общество, Отечество в жизни человека".
Счастье – заслуга или случайный дар?="Семья, общество, Отечество в жизни человека".
Как современная молодёжь относится к традициям?="Семья, общество, Отечество в жизни человека".
Зачем человеку заглядывать в будущее?="Семья, общество, Отечество в жизни человека".
Что важнее для детей: советы родителей или их пример?="Семья, общество, Отечество в жизни человека".
Что может мешать отцам и детям понять друг друга?="Семья, общество, Отечество в жизни человека".
Какого человека можно назвать героем своего времени?="Семья, общество, Отечество в жизни человека".
Как изменится наша жизнь, если в людях исчезнет отзывчивость?="Семья, общество, Отечество в жизни человека".
Почему старшему поколению порой бывает трудно понимать молодёжь?="Семья, общество, Отечество в жизни человека".
Возможно ли общество, в котором все счастливы?="Семья, общество, Отечество в жизни человека".
Война ж – совсем не фейерверк, а просто трудная работа... (М.В. Кульчицкий)="Семья, общество, Отечество в жизни человека".
Какие черты ваших сверстников Вы считаете типичными?="Семья, общество, Отечество в жизни человека".
Неизбежен ли конфликт между поколениями?="Семья, общество, Отечество в жизни человека".
Что вкладывали в понятие «честь» люди XIX века?="Семья, общество, Отечество в жизни человека".
Можно ли быть независимым от общественного мнения?="Семья, общество, Отечество в жизни человека".
Рождается ли истина в споре поколений?="Семья, общество, Отечество в жизни человека".
Может ли волонтёрство изменить жизнь общества к лучшему?="Семья, общество, Отечество в жизни человека".
Война: преступление и подвиг.="Семья, общество, Отечество в жизни человека".
Как Вы оцениваете мысль автора романа «Война и мир» о «духе войска» как главном факторе поражений и побед?="Семья, общество, Отечество в жизни человека".
Какое влияние старшие могут оказать на выбор человеком жизненного пути?="Семья, общество, Отечество в жизни человека".
Портрет читателя моего поколения.="Семья, общество, Отечество в жизни человека".
Разделяете ли Вы представления автора романа «Война и мир» о подлинном героизме?="Семья, общество, Отечество в жизни человека".
Какие проблемы в жизни общества нельзя решить с помощью денег?="Семья, общество, Отечество в жизни человека".
Какие ещё произведения отечественной литературы могли бы носить название или подзаголовок «Отцы и дети»?="Семья, общество, Отечество в жизни человека".
Как не потерять себя, добиваясь успеха в обществе?="Семья, общество, Отечество в жизни человека".
В чём, по-вашему, должна проявляться родительская любовь?="Семья, общество, Отечество в жизни человека".
Что труднее: подчиняться или подчинять?="Семья, общество, Отечество в жизни человека".
Когда жилище становится Домом?="Семья, общество, Отечество в жизни человека".
Меняется ли человек под влиянием других людей?="Семья, общество, Отечество в жизни человека".
Какие черты моего поколения я считаю положительными?="Семья, общество, Отечество в жизни человека".
Герои и антигерои в отечественной истории.="Семья, общество, Отечество в жизни человека".
Какие правила жизни старших поколений я постараюсь передать своим детям?="Семья, общество, Отечество в жизни человека".
Чем молодое поколение похоже на поколение отцов?="Семья, общество, Отечество в жизни человека".
Почему, путешествуя, человек тоскует по дому?="Семья, общество, Отечество в жизни человека".
Чему нужно учиться у современной молодёжи?="Семья, общество, Отечество в жизни человека".
Родители и дети: спор или диалог?="Семья, общество, Отечество в жизни человека".
В чём польза и опасность компромисса?="Семья, общество, Отечество в жизни человека".
Что из прошлого Вы хотели бы перенести в будущее?="Семья, общество, Отечество в жизни человека".
Как связаны понятия «дом» и «отечество»?="Семья, общество, Отечество в жизни человека".
В чём может проявляться любовь к своему отечеству?="Семья, общество, Отечество в жизни человека".
Какие поступки по отношению к другим свидетельствуют о духовной зрелости человека?="Семья, общество, Отечество в жизни человека".
Как можно сохранить и передать потомкам опыт предков?="Семья, общество, Отечество в жизни человека".
Согласны ли Вы с утверждением В.Г. Белинского: «Кто не принадлежит своему отечеству, тот не принадлежит и человечеству»?="Семья, общество, Отечество в жизни человека".
Почему нигилизм свойственен именно молодому поколению?="Семья, общество, Отечество в жизни человека".
Какой опыт даёт человеку война?="Семья, общество, Отечество в жизни человека".
Можно ли судить о поколении по его кумирам?="Семья, общество, Отечество в жизни человека".
Как человек приходит к ратному подвигу?="Семья, общество, Отечество в жизни человека".
История и современность: нужен ли взгляд назад?="Семья, общество, Отечество в жизни человека".
Согласны ли Вы с убеждением автора романа «Война и мир» в том, что патриотизм бывает «истинным» и «ложным»?="Семья, общество, Отечество в жизни человека".
Почему тема войны не уходит из литературы?="Семья, общество, Отечество в жизни человека".
Как связаны между собой эгоизм и одиночество?="Семья, общество, Отечество в жизни человека".
Помощь другим – право или обязанность?="Семья, общество, Отечество в жизни человека".
Согласны ли Вы с убеждением автора романа «Война и мир», что ход исторических событий не определяется волей одного человека?="Семья, общество, Отечество в жизни человека".
Всегда ли общество ценит достойных людей?="Семья, общество, Отечество в жизни человека".
Является ли вечным спор поколений?="Семья, общество, Отечество в жизни человека".
Какие нравственные ценности укрепляют семью?="Семья, общество, Отечество в жизни человека".
В чём может проявляться активная гражданская позиция?="Семья, общество, Отечество в жизни человека".
Что такое «связь времён»?="Семья, общество, Отечество в жизни человека".
Какими качествами должен обладать человек, способный двинуть человечество вперёд?="Семья, общество, Отечество в жизни человека".
Что нужно совершить в жизни, чтобы заслужить благодарную память потомков?="Семья, общество, Отечество в жизни человека".
Почему «отцы» часто недовольны своими «детьми»?="Семья, общество, Отечество в жизни человека".
К чему приводит стремление возвыситься над окружающими?="Семья, общество, Отечество в жизни человека".
Дом – это место или состояние души?="Семья, общество, Отечество в жизни человека".
Может ли общество подавить в человеке индивидуальность?="Семья, общество, Отечество в жизни человека".
Эпоха перемен: потери и обретения.="Семья, общество, Отечество в жизни человека".
Как Вы понимаете слова писателя Ф. Искандера: «У человека есть ещё одна возможность быть счастливым – это умение радоваться чужому счастью»?="Семья, общество, Отечество в жизни человека".
Почему «отцы и дети» – вечная тема?="Семья, общество, Отечество в жизни человека".
Как Вы понимаете выражение «конфликт поколений»?="Семья, общество, Отечество в жизни человека".
В чём сила фронтовой дружбы?="Семья, общество, Отечество в жизни человека".
Легко ли жить в эпоху перемен?="Семья, общество, Отечество в жизни человека".
Всегда ли нужно прислушиваться к общественному мнению?="Семья, общество, Отечество в жизни человека".
Когда родители могут гордиться детьми?="Семья, общество, Отечество в жизни человека".
В чём состоят обязанности человека перед обществом?="Семья, общество, Отечество в жизни человека".
Когда человек может чувствовать себя одиноким в обществе?="Семья, общество, Отечество в жизни человека".
Что может помешать полноценному диалогу людей разных поколений?="Семья, общество, Отечество в жизни человека".
Какая историческая эпоха Вам особенно интересна и почему?="Семья, общество, Отечество в жизни человека".
Что связывает сегодняшних людей с предыдущим поколением?="Семья, общество, Отечество в жизни человека".
Почему человек, живущий в обществе, не может быть свободным от него?="Семья, общество, Отечество в жизни человека".
Чем может быть ценен для отцов опыт детей?="Семья, общество, Отечество в жизни человека".
Война Отечественная и война Гражданская – в чём отличие?="Семья, общество, Отечество в жизни человека".
Влияет ли историческая эпоха на отношения «отцов» и «детей»?="Семья, общество, Отечество в жизни человека".
Можно ли найти счастье в том, чтобы помогать несчастным?="Семья, общество, Отечество в жизни человека".
Согласны ли Вы с утверждением Ф.М. Достоевского: «Каждый человек несёт ответственность перед всеми людьми за всех людей и за всё»?="Семья, общество, Отечество в жизни человека".
Почему важно понимать чужое мнение?="Семья, общество, Отечество в жизни человека".
Когда человек становится личностью?="Семья, общество, Отечество в жизни человека".
Конфликт поколений как общественная проблема.="Семья, общество, Отечество в жизни человека".
Что может стать основой взаимопонимания между людьми разных поколений?="Семья, общество, Отечество в жизни человека".
Почему тема «отцов и детей» часто присутствует во многих произведениях литературы?="Семья, общество, Отечество в жизни человека".
Есть ли место гуманизму на войне?="Семья, общество, Отечество в жизни человека".
Забвение прошлого губительно для человека?="Семья, общество, Отечество в жизни человека".
Всегда ли ценны заветы отцов?="Семья, общество, Отечество в жизни человека".
Война и дом.="Семья, общество, Отечество в жизни человека".
Согласны ли Вы с мыслью автора романа «Война и мир» о том, что «война противна человеческому разуму и всей человеческой природе»?="Семья, общество, Отечество в жизни человека".
Может ли старшее поколение понять младшее?="Семья, общество, Отечество в жизни человека".
Какое время можно назвать временем перемен?="Семья, общество, Отечество в жизни человека".
Что нужно, чтобы построить дом в собственной душе?="Семья, общество, Отечество в жизни человека".
Почему старшее поколение так редко бывает довольно молодёжью?="Семья, общество, Отечество в жизни человека".
Бывает ли так, что один прав, а все ошибаются?="Семья, общество, Отечество в жизни человека".
Какие традиционные ценности остаются важными для Вас в стремительно меняющемся мире?="Семья, общество, Отечество в жизни человека".
Каковы духовные ценности современного поколения?="Семья, общество, Отечество в жизни человека".
Какова роль дома и семьи в сохранении и передаче жизненного опыта?="Семья, общество, Отечество в жизни человека".
Что в доме самое главное?="Семья, общество, Отечество в жизни человека".
Как Вы относитесь к такой жизненной позиции: «не нуждаюсь ни в чьих советах»? ="Семья, общество, Отечество в жизни человека".
Какие события в истории нашей страны вызывают у вас гордость?="Семья, общество, Отечество в жизни человека".
Почему тема весны так популярна у писателей?="Природа и культура в жизни человека".
Можно ли обойтись в жизни без творчества?="Природа и культура в жизни человека".
Нужно ли художнику обладать творческой смелостью?="Природа и культура в жизни человека".
Как вы понимаете выражение "творческая смелость художника"?="Природа и культура в жизни человека".
Чтение литературного произведения – труд или отдых?="Природа и культура в жизни человека".
Произведение, адресованное моему поколению.="Природа и культура в жизни человека".
Справедливо ли выражение: «Жизнь коротка – искусство вечно»?="Природа и культура в жизни человека".
К какому художественному произведению (музыке, фильму, спектаклю) я захочу обратиться ещё раз?="Природа и культура в жизни человека".
Технический прогресс на службе у человека или наоборот?="Природа и культура в жизни человека".
Какие возможности человека расширяет технический прогресс?="Природа и культура в жизни человека".
Какие книги Вам особенно интересны?="Природа и культура в жизни человека".
Обязательно к прочтению (прослушиванию, просмотру)!="Природа и культура в жизни человека".
Доступность информации в цифровую эпоху: за и против.="Природа и культура в жизни человека".
Моя любимая книга (музыка, фильм, спектакль).="Природа и культура в жизни человека".
Обо всех и обо мне – подлинное творение искусства.="Природа и культура в жизни человека".
Почему человек постоянно стремится заглянуть в будущее?="Природа и культура в жизни человека".
С кем из литературных героев Вы бы отправились в путешествие?="Природа и культура в жизни человека".
Какая угроза способна объединить человечество?="Природа и культура в жизни человека".
Какое художественное произведение (музыка, фильм, спектакль) я могу назвать своим «учебником жизни»?="Природа и культура в жизни человека".
Произведение (книга, музыка, фильм, спектакль), которое открывает путь к самопознанию.="Природа и культура в жизни человека".
Почему многие люди боятся перемен в жизни?="Природа и культура в жизни человека".
Как Вы понимаете призыв Н.А. Некрасова: «Служа искусству, для блага ближнего живи»?="Природа и культура в жизни человека".
Должно ли искусство воспитывать людей?="Природа и культура в жизни человека".
Есть ли что-то в человеческой жизни, что невозможно заменить никакими технологиями?="Природа и культура в жизни человека".
Способна ли природа воспитывать человека?="Природа и культура в жизни человека".
Книги моего детства.="Природа и культура в жизни человека".
Как мир человеческих чувств соотносится с временами года?="Природа и культура в жизни человека".
В память о каком писателе Вы бы открыли музей?="Природа и культура в жизни человека".
Как искусство помогает понять действительность?="Природа и культура в жизни человека".
Почему тема времён года так интересна писателям?="Природа и культура в жизни человека".
Какую книгу я бы посоветовал прочитать другу?="Природа и культура в жизни человека".
Помогает ли человеку книга лучше понять себя?="Природа и культура в жизни человека".
Какие вопросы, поднятые в литературе, не теряют своей актуальности с течением времени?="Природа и культура в жизни человека".
Помогают ли произведения искусства (книга, музыка, фильм, спектакль) лучше понять себя?="Природа и культура в жизни человека".
Какое произведение литературы, по Вашему мнению, будут помнить в XXII веке и почему?="Природа и культура в жизни человека".
Прав ли П.И. Чайковский, утверждавший, что «искусство создает хороших людей, формирует человеческую душу»?="Природа и культура в жизни человека".
Какова роль искусства в жизни общества?="Природа и культура в жизни человека".
